{"assessment_id":"urn:acef:asx:7efa6d88-264b-4099-bd56-456d371944e4","assessor":{"name":"acef-validator","organization":"AI Commons","version":"0.1.0"},"evaluation_instant":"2026-09-15T00:00:00Z","evidence_bundle_ref":{"content_hash":"sha256:56f617eb6565143eaec736c51d748a25b3013d323e26363718a0e0cbdd9347f4","package_id":"urn:acef:pkg:25859740-bd13-4ba1-b6db-8c0f979d48c9"},"integrity":null,"profiles_evaluated":["nist-ai-rmf-1.0:1.0.0"],"provision_summary":[{"evidence_refs":["urn:acef:rec:a7a8bbe7-9954-4685-9068-6106a4b885fd","urn:acef:rec:f8d7f96c-5358-4acd-af6a-a1754ae7bdc0"],"fail_count":0,"profile_id":"nist-ai-rmf-1.0","provision_id":"govern-1","provision_outcome":"satisfied","skipped_count":0,"subject_scope":["urn:acef:sub:ce4c5016-6bdf-47d2-bb83-a20229686fb4"],"warning_count":0},{"evidence_refs":["urn:acef:rec:41d17d4c-3f0c-4324-a9a1-003fbd477a0d"],"fail_count":0,"profile_id":"nist-ai-rmf-1.0","provision_id":"map-1","provision_outcome":"satisfied","skipped_count":0,"subject_scope":["urn:acef:sub:ce4c5016-6bdf-47d2-bb83-a20229686fb4"],"warning_count":0},{"evidence_refs":["urn:acef:rec:61e77222-cd1b-49a7-9798-ee56980d5efa"],"fail_count":0,"profile_id":"nist-ai-rmf-1.0","provision_id":"manage-1","provision_outcome":"satisfied","skipped_count":0,"subject_scope":["urn:acef:sub:ce4c5016-6bdf-47d2-bb83-a20229686fb4"],"warning_count":0},{"evidence_refs":["urn:acef:rec:54b99c94-b53e-420c-8361-689132621755"],"fail_count":0,"profile_id":"nist-ai-rmf-1.0","provision_id":"measure-1","provision_outcome":"satisfied","skipped_count":0,"subject_scope":["urn:acef:sub:ce4c5016-6bdf-47d2-bb83-a20229686fb4"],"warning_count":0}],"results":[{"evidence_refs":["urn:acef:rec:a7a8bbe7-9954-4685-9068-6106a4b885fd","urn:acef:rec:f8d7f96c-5358-4acd-af6a-a1754ae7bdc0"],"message":null,"outcome":"passed","profile_id":"nist-ai-rmf-1.0","provision_id":"govern-1","rule_id":"govern1-governance-policy","rule_severity":"fail","subject_scope":["urn:acef:sub:ce4c5016-6bdf-47d2-bb83-a20229686fb4"]},{"evidence_refs":["urn:acef:rec:f8d7f96c-5358-4acd-af6a-a1754ae7bdc0"],"message":null,"outcome":"passed","profile_id":"nist-ai-rmf-1.0","provision_id":"govern-1","rule_id":"govern1-policy-attachment","rule_severity":"warning","subject_scope":["urn:acef:sub:ce4c5016-6bdf-47d2-bb83-a20229686fb4"]},{"evidence_refs":["urn:acef:rec:a7a8bbe7-9954-4685-9068-6106a4b885fd","urn:acef:rec:f8d7f96c-5358-4acd-af6a-a1754ae7bdc0"],"message":null,"outcome":"passed","profile_id":"nist-ai-rmf-1.0","provision_id":"govern-1","rule_id":"govern1-policy-entity-linked","rule_severity":"warning","subject_scope":["urn:acef:sub:ce4c5016-6bdf-47d2-bb83-a20229686fb4"]},{"evidence_refs":["urn:acef:rec:41d17d4c-3f0c-4324-a9a1-003fbd477a0d"],"message":null,"outcome":"passed","profile_id":"nist-ai-rmf-1.0","provision_id":"map-1","rule_id":"map1-risk-register","rule_severity":"fail","subject_scope":["urn:acef:sub:ce4c5016-6bdf-47d2-bb83-a20229686fb4"]},{"evidence_refs":["urn:acef:rec:41d17d4c-3f0c-4324-a9a1-003fbd477a0d"],"message":null,"outcome":"passed","profile_id":"nist-ai-rmf-1.0","provision_id":"map-1","rule_id":"map1-risk-entity-linked","rule_severity":"warning","subject_scope":["urn:acef:sub:ce4c5016-6bdf-47d2-bb83-a20229686fb4"]},{"evidence_refs":["urn:acef:rec:41d17d4c-3f0c-4324-a9a1-003fbd477a0d"],"message":null,"outcome":"passed","profile_id":"nist-ai-rmf-1.0","provision_id":"map-1","rule_id":"map1-risk-category","rule_severity":"warning","subject_scope":["urn:acef:sub:ce4c5016-6bdf-47d2-bb83-a20229686fb4"]},{"evidence_refs":["urn:acef:rec:54b99c94-b53e-420c-8361-689132621755"],"message":null,"outcome":"passed","profile_id":"nist-ai-rmf-1.0","provision_id":"measure-1","rule_id":"measure1-evaluation-report","rule_severity":"fail","subject_scope":["urn:acef:sub:ce4c5016-6bdf-47d2-bb83-a20229686fb4"]},{"evidence_refs":["urn:acef:rec:54b99c94-b53e-420c-8361-689132621755"],"message":null,"outcome":"passed","profile_id":"nist-ai-rmf-1.0","provision_id":"measure-1","rule_id":"measure1-metrics-present","rule_severity":"warning","subject_scope":["urn:acef:sub:ce4c5016-6bdf-47d2-bb83-a20229686fb4"]},{"evidence_refs":["urn:acef:rec:54b99c94-b53e-420c-8361-689132621755"],"message":null,"outcome":"passed","profile_id":"nist-ai-rmf-1.0","provision_id":"measure-1","rule_id":"measure1-methodology-present","rule_severity":"warning","subject_scope":["urn:acef:sub:ce4c5016-6bdf-47d2-bb83-a20229686fb4"]},{"evidence_refs":["urn:acef:rec:61e77222-cd1b-49a7-9798-ee56980d5efa"],"message":null,"outcome":"passed","profile_id":"nist-ai-rmf-1.0","provision_id":"manage-1","rule_id":"manage1-risk-treatment","rule_severity":"fail","subject_scope":["urn:acef:sub:ce4c5016-6bdf-47d2-bb83-a20229686fb4"]},{"evidence_refs":["urn:acef:rec:61e77222-cd1b-49a7-9798-ee56980d5efa"],"message":null,"outcome":"passed","profile_id":"nist-ai-rmf-1.0","provision_id":"manage-1","rule_id":"manage1-treatment-type","rule_severity":"warning","subject_scope":["urn:acef:sub:ce4c5016-6bdf-47d2-bb83-a20229686fb4"]},{"evidence_refs":["urn:acef:rec:61e77222-cd1b-49a7-9798-ee56980d5efa"],"message":null,"outcome":"passed","profile_id":"nist-ai-rmf-1.0","provision_id":"manage-1","rule_id":"manage1-treatment-entity-linked","rule_severity":"warning","subject_scope":["urn:acef:sub:ce4c5016-6bdf-47d2-bb83-a20229686fb4"]}],"structural_errors":[{"category":"schema","code":"ACEF-002","message":"Manifest schema violation: '' does not match '^urn:acef:act:[0-9a-f]{8}-[0-9a-f]{4}-[0-9a-f]{4}-[0-9a-f]{4}-[0-9a-f]{12}$'","path":"/audit_trail/0/actor_ref","severity":"fatal"}],"template_digests":{"nist-ai-rmf-1.0:1.0.0":"sha256:f08cc69b1956b6197ca4705353c03efcd06dee068c4bc6844fe0a02b49b34d40"},"timestamp":"2026-03-18T20:59:29Z","versioning":{"assessment_version":"1.0.0","core_version":"1.0.0"}}