{
  "assessment_id": "urn:acef:asx:e5339b62-e2e9-48b7-865b-8d312289dc44",
  "assessor": {
    "name": "acef-validator",
    "organization": "AI Commons",
    "version": "0.1.0"
  },
  "evaluation_instant": "2026-03-15T12:00:00Z",
  "evidence_bundle_ref": {
    "content_hash": "sha256:a8b4507c6323f5e83d847977326c811060694201a5f93ba3a5c7405e3edda041",
    "package_id": "urn:acef:pkg:eb3d9ab0-0d30-4ac3-8b68-88182c1c0c14"
  },
  "integrity": null,
  "profiles_evaluated": [
    "eu-ai-act-2024:1.1.0"
  ],
  "provision_summary": [
    {
      "evidence_refs": [],
      "fail_count": 0,
      "profile_id": "eu-ai-act-2024",
      "provision_id": "article-12",
      "provision_outcome": "skipped",
      "skipped_count": 5,
      "subject_scope": [
        "urn:acef:sub:c9734c17-8a1f-4991-9db8-eae12c9992c4"
      ],
      "warning_count": 0
    }
  ],
  "results": [
    {
      "error_code": null,
      "evidence_refs": [],
      "message": "Provision not yet effective (effective_date=2026-08-02, evaluation_instant=2026-03-15T12:00:00Z)",
      "outcome": "skipped",
      "profile_id": "eu-ai-act-2024",
      "provision_id": "article-12",
      "rule_id": "art12-event-log",
      "rule_severity": "fail",
      "subject_scope": [
        "urn:acef:sub:c9734c17-8a1f-4991-9db8-eae12c9992c4"
      ]
    },
    {
      "error_code": null,
      "evidence_refs": [],
      "message": "Provision not yet effective (effective_date=2026-08-02, evaluation_instant=2026-03-15T12:00:00Z)",
      "outcome": "skipped",
      "profile_id": "eu-ai-act-2024",
      "provision_id": "article-12",
      "rule_id": "art12-event-type-present",
      "rule_severity": "fail",
      "subject_scope": [
        "urn:acef:sub:c9734c17-8a1f-4991-9db8-eae12c9992c4"
      ]
    },
    {
      "error_code": null,
      "evidence_refs": [],
      "message": "Provision not yet effective (effective_date=2026-08-02, evaluation_instant=2026-03-15T12:00:00Z)",
      "outcome": "skipped",
      "profile_id": "eu-ai-act-2024",
      "provision_id": "article-12",
      "rule_id": "art12-correlation-id-present",
      "rule_severity": "fail",
      "subject_scope": [
        "urn:acef:sub:c9734c17-8a1f-4991-9db8-eae12c9992c4"
      ]
    },
    {
      "error_code": null,
      "evidence_refs": [],
      "message": "Provision not yet effective (effective_date=2026-08-02, evaluation_instant=2026-03-15T12:00:00Z)",
      "outcome": "skipped",
      "profile_id": "eu-ai-act-2024",
      "provision_id": "article-12",
      "rule_id": "art12-logging-spec",
      "rule_severity": "warning",
      "subject_scope": [
        "urn:acef:sub:c9734c17-8a1f-4991-9db8-eae12c9992c4"
      ]
    },
    {
      "error_code": null,
      "evidence_refs": [],
      "message": "Provision not yet effective (effective_date=2026-08-02, evaluation_instant=2026-03-15T12:00:00Z)",
      "outcome": "skipped",
      "profile_id": "eu-ai-act-2024",
      "provision_id": "article-12",
      "rule_id": "art12-entity-linked",
      "rule_severity": "warning",
      "subject_scope": [
        "urn:acef:sub:c9734c17-8a1f-4991-9db8-eae12c9992c4"
      ]
    }
  ],
  "structural_errors": [
    {
      "category": "profile",
      "code": "ACEF-032",
      "message": "Provision article-12 not yet effective (effective: 2026-08-02, evaluation: 2026-03-15T12:00:00Z)",
      "severity": "info"
    }
  ],
  "template_digests": {
    "eu-ai-act-2024:1.1.0": "sha256:ffc9bb757d8148596c5eff491f7df037bac200076099506ed02401c7e85a6d2c"
  },
  "timestamp": "2026-06-17T18:04:18Z",
  "versioning": {
    "assessment_version": "1.0.0",
    "core_version": "1.0.0"
  }
}
